owner_id	audience	query_or_intent	owner_url	owner_role	overlap_urls	current_state	finalization_evidence	do_not_create
QO-01	China + UK arrival	giffgaff 国内激活	/guides/2-activate/	activation workflow and failure recovery	/qa/06-activation-expiration/	provisional	GSC 28/90-day query-page data; URL Inspection; fixed SERP overlap; official-source freshness	parallel 留学生激活 or 中国激活 URLs
QO-02	China + returning UK users	giffgaff 保号	/guides/3-usage/	inactivity rule and maintenance checklist	/tools/keep-number-reminder/	provisional	GSC query-page data; inactive-rule freshness; tool-versus-guide intent review	parallel 180天保号 or 留学生保号 URLs
QO-03	China	giffgaff 收不到验证码	/guides/4-signal/	network then ordinary SMS then OTP layered diagnosis	/research/otp-status/|/more/00-wechat/|/more/02-telegram/|/qa/08-gv/	provisional	GSC query-page data; platform-specific official facts or qualifying samples; no OTP guarantee	new platform guarantee pages
QO-04	China	giffgaff 中国漫游费用	/tools/china-roaming-cost/	China PAYG Credit billing-unit arithmetic	/guides/5-travel-data/	provisional	GSC/SERP overlap; corrected production formula; claim freshness; add-on/PAYG separation	parallel roaming calculator URLs
QO-05	China + UK arrival	giffgaff eSIM 转换	/more/03-esim/	official App switching path and recovery boundaries	/more/04-esim-qrcode/|/tools/esim-compatibility/	provisional	GSC query-page data; current official workflow; exact-device evidence where compatibility is claimed	bypass, modified APK, credential extraction or write-card pages
QO-06	UK students and travellers	英国手机卡怎么选	/guides/8-uk-sim-choice/	scenario decision hub	/shop/|/answers/	provisional	GSC/SERP data; Ofcom/operator sources; no unsupported best-network ranking	parallel 留学生选卡 or 旅行选卡 URLs
QO-07	China buyers + UK arrivals	giffgaff 收卡及落地验收	/guides/7-arrival-checklist/	post-delivery, pre-departure and arrival verification	/guides/1-order/|/answers/	provisional	GSC/SERP data; real journey evidence if described as tested; order-specific evidence for commercial claims	parallel G0/G2 batch-state claim pages
